{
  "$schema": "./Base.Schema.json",
  "description": "settings for workspaces",
  "schemaPrefix": "szewtwin/core/workspace",
  "settingDefs": {
    "settingsWorkspaces": {
      "description": "An array of resourceName, WorkspaceDb properties, each of which holds a Settings.Dictionary. Each entry also holds the settings priority for loading the dictionary.",
      "type": "array",
      "items": {
        "type": "object",
        "extends": "szewtwin/core/workspace/workspaceDb",
        "properties": {
          "resourceName": {
            "type": "string",
            "description": "the name of the string resource holding the settings dictionary in this WorkspaceDb",
            "default": "settingsDictionary"
          },
          "priority": {
            "type": "number",
            "description": "the SettingsPriority for the settingsDictionary",
            "default": 500
          }
        }
      }
    }
  },
  "typeDefs": {
    "workspaceDb": {
      "type": "object",
      "description": "WorkspaceDb properties",
      "required": [
        "containerId",
        "baseUri"
      ],
      "properties": {
        "dbName": {
          "type": "string",
          "description": "the name of the database within its cloud container. If not present, defaults to 'workspace-db'."
        },
        "baseUri": {
          "type": "string",
          "description": "the baseUri for the container, without trailing slash (e.g., https://containers.szewtwinjs.org)"
        },
        "containerId": {
          "type": "string",
          "description": "the containerId of this cloud container. Usually a Guid"
        },
        "storageType": {
          "type": "string",
          "description": "one of: 'azure', 'aws', 'google'",
          "default": "azure"
        },
        "description": {
          "type": "string",
          "description": "information about what is in this workspace"
        },
        "loadingHelp": {
          "type": "string",
          "description": "in case there is a problem loading this workspace, show this message"
        },
        "isPublic": {
          "type": "boolean",
          "description": "whether the cloud container is public (doesn't require authentication)",
          "default": false
        },
        "version": {
          "type": "string",
          "description": "the (semver) range of acceptable versions",
          "default": "^1"
        },
        "includePrerelease": {
          "type": "boolean",
          "description": "include prerelease in acceptable versions"
        },
        "prefetch": {
          "type": "boolean",
          "description": "if true, pre-fetch all of the data from the cloud in the background"
        },
        "syncOnConnect": {
          "type": "boolean",
          "description": "if false, do not attempt to synchronize with cloud when workspace is loaded",
          "hidden": true
        }
      }
    },
    "workspaceDbList": {
      "type": "array",
      "combineArray": true,
      "items": {
        "type": "object",
        "extends": "szewtwin/core/workspace/workspaceDb"
      }
    }
  }
}